{
  "ollama": {
    "version": "v0.5.7",
    "sha256": "eb565d16c8025e37d09fbb234c627c7c13f05c5f007bfa8f76fa6b6b8695ca31",
    "url": "https://github.com/ollama/ollama/releases/download/v0.5.7/ollama-windows-amd64.zip"
  },
  "models": {
    "gemma2:2b":          {"digest": "sha256:7462734796d67c40ecec2ca98eddf970e171dbb6b370e43fd633ee75b69abe1b"},
    "gemma2:9b":          {"digest": "sha256:ff1d1fc78170d787ee1201778e2dd65ea211654ca5fb7d69b5a2e7b123a50373"},
    "qwen2.5-coder:1.5b": {"digest": "sha256:29d8c98fa6b098e200069bfb88b9508dc3e85586d20cba59f8dda9a808165104"},
    "qwen2.5-coder:7b":   {"digest": "sha256:60e05f2100071479f596b964f89f510f057ce397ea22f2833a0cfe029bfc2463"}
  },
  "data_lakes": {
    "aact": {"zenodo_doi": null, "sha256": null, "bytes": null, "status": "pending_plan_D"},
    "who":  {"zenodo_doi": null, "sha256": null, "bytes": null, "status": "pending_plan_D"},
    "wb":   {"zenodo_doi": null, "sha256": null, "bytes": null, "status": "pending_plan_D"},
    "ihme": {"zenodo_doi": null, "sha256": null, "bytes": null, "status": "pending_plan_D"}
  },
  "python_embed": {
    "version": "3.11.9",
    "sha256": "009d6bf7e3b2ddca3d784fa09f90fe54336d5b60f0e0f305c37f400bf83cfd3b",
    "url": "https://www.python.org/ftp/python/3.11.9/python-3.11.9-embed-amd64.zip"
  },
  "bundle_release": {
    "version": "0.2.0-plan-A",
    "self_sha256": null
  }
}
